filler,en,sq,ar,bg,hr,da,nl,et,fa,fr,de,el,hu,it,ja,lt,nb,pl,pt,ro,ru,sr,sk,es,sv,th,tr
NOT_CONNECTED,You are currently not connected to server,Ju aktualisht nuk janë të lidhura me serverin,أنت غير متصل حاليا إلى خادم,В момента не сте свързани към сървъра,Trenutno niste povezani s poslužiteljem,Du er i øjeblikket ikke forbundet til serveren,Je hebt momenteel geen verbinding met de server,Te ei ole praegu ühendatud server,شما در حال حاضر به سرور متصل نیست,Vous n'êtes pas connecté au serveur,Sie sind zur Zeit nicht an den Server angeschlossen,Αυτήν τη στιγμή δεν υπάρχει σύνδεση,Ön jelenleg nem csatlakozik a szerverre,Lei non si è connessi al server,あなたは現在サーバーに接続されていません,Šiuo metu Jūs nesate prisijungę prie serverio,Du er ikke koblet til serveren,Obecnie nie jesteś podłączony do serwera,No momento você não está conectado ao servidor,"În prezent, nu sunt conectate la serverul",Вы в настоящее время не подключены к серверу,Тренутно нисте повезани на сервер,Tie sú v súčasnej dobe nie je pripojená k serveru,No has conectado al servidor,Du är inte ansluten till servern,คุณยังไม่ได้เชื่อมต่อกับเซิร์ฟเวอร์,Şu anda sunucuya bağlı değildir
PLS_CHECK_INTERNET,Please check your internet connection,Ju lutem kontrolloni lidhjen tuaj te internetit,الرجاء التحقق من اتصال الانترنت الخاص بك,"Моля, проверете интернет връзката си",Provjerite svoju internetsku vezu,Tjek din internetforbindelse,Controleer uw internetverbinding,Palun kontrollige oma internetiühendust,لطفا اتصال به اینترنت خود را چک کنید,S'il vous plaît vérifier votre connexion Internet,Bitte überprüfe deine Internetverbindung,Ελέγξτε τη σύνδεσή σας στο Internet,"Kérjük, ellenőrizze az internetkapcsolatot",Per favore controlla la tua connessione Internet,インターネット接続を確認してください,Prašome patikrinti savo interneto ryšį,Vennligst sjekk din internettforbindelse,Proszę sprawdzić swoje połączenie z internetem,"Por favor, verifique sua conexão com a internet",Vă rugăm să verificați conexiunea la Internet,"Пожалуйста, проверьте подключение к интернету",Проверите интернет конекцију,Skontrolujte pripojenie k internetu,Por favor revise su conexion a internet,Kontrollera din Internet-anslutning,กรุณาตรวจสอบการเชื่อมต่ออินเทอร์เน็ตของคุณ,Lütfen İnternet bağlantınızı kontrol edin
USERNAME,Username,Emri i përdoruesit,اسم المستخدم,Потребител,Korisničko ime,Brugernavn,Gebruikersnaam,Kasutajanimi,نام کاربری,Nom d'utilisateur,Benutzername,Όνομα Χρήστη,Felhasználónév,Nome utente,ユーザー名,Vartotojo vardas,Brukernavn,Nazwa Użytkownika,Nome de Usuário,Nume de utilizator,имя пользователя,Корисничко име,užívateľské meno,Nombre de usuario,Användarnamn,ชื่อผู้ใช้,Kullanıcı adı
PASSWORD,Password,fjalëkalim,كلمه السر,парола,Lozinka,Adgangskode,Wachtwoord,parool,کلمه عبور,Mot de passe,Passwort,Κωδικός πρόσβασης,Jelszó,Parola d'ordine,パスワード,slaptažodis,Passord,Hasło,Senha,Parola,пароль,лозинка,heslo,Contraseña,Lösenord,รหัสผ่าน,Parola
LOGIN,LOGIN,LOGIN,تسجيل الدخول,ВХОД,PRIJAVITI SE,LOG PÅ,LOG IN,LOGI SISSE,ورود,S'IDENTIFIER,ANMELDUNG,ΣΥΝΔΕΣΗ,BELÉPEK,ACCESSO,ログイン,PRISIJUNGTI,LOGG INN,ZALOGUJ SIĘ,ENTRAR,LOGARE,АВТОРИЗОВАТЬСЯ,ПРИЈАВИТЕ СЕ,PRIHLÁSIŤ SA,INICIAR SESIÓN,LOGGA IN,เข้าสู่ระบบ,OTURUM AÇ
RECOVER_PASSWORD,Recover Password,Recover Password,إستعادة كلمة المرور,Възстановяване на парола,Obnova lozinke,Gendan adgangskode,Wachtwoord herstellen,Taasta parool,بازیابی رمز عبور,Récupérer mot de passe,Passwort wiederherstellen,Ανάκτηση κωδικού πρόσβασης,Új jelszó,Recupera la password,パスワードを回復,Atstatyti slaptažodį,Gjenopprett passord,Odzyskaj hasło,recuperar Senha,Recuperează parola,Восстановить пароль,Рецовер Пассворд,Obnoviť heslo,Recuperar contraseña,Återställa lösenord,กู้คืนรหัสผ่าน,Şifre kurtarma
PLS_CHECK_EMAIL,Please check email.,Ju lutem kontrolloni email.,يرجى التحقق من البريد الإلكتروني.,"Моля, проверете електронната поща.",Provjerite e-poštu.,Kontroller e-mail.,Controleer e-mail.,Palun kontrollige e-posti.,لطفا ایمیل را بررسی کنید.,S'il vous plaît vérifier le courrier électronique.,Bitte überprüfen Sie E-Mail.,Ελέγξτε το ηλεκτρονικό ταχυδρομείο.,"Kérjük, ellenőrizze az e-mail.",Si prega di controllare la posta elettronica.,電子メールをチェックしてください。,Prašome patikrinti laišką.,Vennligst sjekk e-posten.,Proszę sprawdzić e-mail.,"Por favor, verifique e-mail.",Vă rugăm să verificați e-mail.,"Пожалуйста, проверьте электронную почту.",Молимо вас да проверите е-пошту.,Skontrolujte prosím e-mail.,Por favor revise su correo electronico.,Kontrollera e-post.,โปรดตรวจสอบอีเมล,postanızı kontrol edin.
TEMPORARY_PASSWORD,Your temporary password will be sent to you by e-mail.,Fjalëkalimi juaj i përkohshëm do të dërgohet tek ju me e-mail.,سيتم إرسال كلمة مرور مؤقتة لك عن طريق البريد الإلكتروني.,Вашата временна парола ще ви бъде изпратена по електронната поща.,Vaš privremena lozinka će biti poslana na vas putem e-maila.,Din midlertidigt kodeord vil blive sendt til dig via e-mail.,Uw tijdelijke wachtwoord wordt per e-mail naar u worden verzonden.,Ajutine parool saadetakse teile e-posti teel.,رمز عبور موقت شما خواهد شد به شما از طریق ایمیل ارسال می شود.,Votre mot de passe temporaire vous sera envoyé par e-mail.,Ihr temporäres Passwort werden Ihnen per E-Mail.,προσωρινός κωδικός πρόσβασης θα σας αποσταλεί σε εσάς μέσω e-mail.,Az ideiglenes jelszót küldünk Önnek e-mailben.,La password temporanea sarà inviata per e-mail.,あなたの一時的なパスワードがメールで送信されます。,Jūsų laikinas slaptažodis bus išsiųstas jums el.paštu.,Din midlertidig passord vil bli sendt til deg på e-post.,Twoje tymczasowe hasło zostanie wysłane na adres e-mail.,A sua senha temporária será enviada por e-mail.,Parola dvs. temporară va fi trimisă prin e-mail.,Ваш временный пароль будет отправлен вам по электронной почте.,Ваш привремена лозинка ће бити послати путем е-маила.,Vaše dočasné heslo bude zaslané na Váš e-mail.,Su contraseña temporal será enviada a usted por correo electrónico.,Din tillfälligt lösenord kommer att skickas till dig via e-post.,รหัสผ่านชั่วคราวของคุณจะถูกส่งถึงคุณผ่านทาง e-mail,Geçici şifreniz e-posta ile gönderilecektir.
EMAIL,Email,Email,البريد الإلكتروني,електронна поща,E-mail,E-mail,E-mail,Saatke,پست الکترونیک,Email,Email,ΗΛΕΚΤΡΟΝΙΚΗ ΔΙΕΥΘΥΝΣΗ,Email,E-mail,Eメール,paštas,e-post,E-mail,O email,E-mail,Эл. адрес,емаил,e-mail,Email,E-post,อีเมล์,E-posta
RECOVER,Recover,shërohem,استعادة,възвръщам,Oporavak,Gendanne,Herstellen,taastuma,بهبود یافتن,Récupérer,genesen,Αναρρώνω,Visszaszerez,Recuperare,回復します,atsigauti,Gjenopprette,Wyzdrowieć,Recuperar,Recupera,оправляться,Опоравити се,zotaviť sa,Recuperar,Ta igen sig,กู้,Kurtarmak
CANCEL,Cancel,anuloj,إلغاء,Отказ,Otkazati,Afbestille,Annuleer,tühistama,لغو کردن,Annuler,Stornieren,Ακύρωση,Megszünteti,Annulla,キャンセル,atšaukti,Avbryt,Anuluj,Cancelar,Anulare,Отмена,Отказати,Zrušiť,Cancelar,Annullera,ยกเลิก,İptal etmek
CHECK_FIELDS,Please check the fields.,Ju lutem kontrolloni fushat.,يرجى التحقق من المجالات.,"Моля, проверете полето.",Molimo provjerite polja.,Kontroller markerne.,Controleer de velden.,Palun kontrollige väljad.,لطفا فیلدهای تیک بزنید.,S'il vous plaît vérifier les champs.,Überprüfen Sie bitte die Felder aus.,Ελέγξτε τα πεδία.,"Kérjük, ellenőrizze a mezőket.",Si prega di verificare i campi.,フィールドを確認してください。,Prašome patikrinti laukus.,Kontroller feltene.,Proszę sprawdzić pól.,"Por favor, verifique os campos.",Vă rugăm să verificați câmpurile.,"Пожалуйста, проверьте поля.",Проверите поља.,Skontrolujte polia.,"Por favor, compruebe los campos.",Kontrollera fälten.,กรุณาตรวจสอบฟิลด์,alanları kontrol edin.
USERNAME_INVALID,Username or password is invalid.,Emri i përdoruesit ose fjalëkalimi është e pavlefshme.,اسم المستخدم أو كلمة المرور غير صالحة.,Потребителско име и парола са невалидни.,Korisničko ime ili zaporka nisu valjani.,Brugernavn eller adgangskode er ugyldig.,Gebruikersnaam of wachtwoord is ongeldig.,Kasutajanimi või parool on vale.,نام کاربری یا رمز عبور نامعتبر است.,Nom d'utilisateur ou mot de passe est invalide.,Benutzername oder Passwort ist ungültig.,Το όνομα χρήστη ή τον κωδικό πρόσβασης δεν είναι έγκυρος.,Felhasználónév vagy jelszó érvénytelen.,Nome utente o la password non sono validi.,ユーザー名またはパスワードが無効です。,Naudotojo vardas arba slaptažodis neteisingas.,Brukernavn eller passord er ugyldig.,Nazwa użytkownika lub hasło jest nieprawidłowe.,Nome de usuário ou senha é inválida.,Numele de utilizator sau parola este nevalid.,Имя пользователя или пароль неверен.,Корисничко име или лозинка није исправан.,Užívateľské meno alebo heslo je neplatné.,Nombre de usuario o contraseña no son válidos.,Användarnamn eller lösenord är ogiltigt.,ชื่อผู้ใช้หรือรหัสผ่านไม่ถูกต้อง,Kullanıcı adı veya şifre geçersiz.
OK,OK,Ne rregull,حسنا,Добре,u redu,Okay,OK,Okei,خوب,D'accord,OK,Εντάξει,rendben,ok,[OK],Gerai,OK,ok,Está bem,O.K,ОК,ок,OK,DE ACUERDO,ok,ตกลง,tamam
WANT_TO_LOGOUT,Are you sure you want to logout?,Jeni te sigurte qe doni te logout?,هل أنت متأكد أنك تريد تسجيل الخروج؟,Наистина ли искате да излезете ли сте?,Jeste li sigurni da želite odjaviti?,Er du sikker på du vil logge ud?,Weet je zeker dat je wil uitloggen?,"Oled sa kindel, et soovid välja logida?",آیا برای خارج شدن مطمئن هستید؟,Êtes-vous sûr de vouloir vous déconnecter?,"Sind Sie sicher, dass Sie sich ausloggen?",Είστε βέβαιοι ότι θέλετε να αποσυνδεθείτε?,Biztosan szeretne kijelentkezni?,Sei sicuro di voler uscire?,あなたがログアウトしてもよろしいですか？,Ar tikrai norite išsiregistruoti?,Er du sikker på at du vil logge ut?,Czy na pewno chcesz się wylogować?,Tem certeza que deseja sair?,Sigur vrei să te deconectezi?,Вы действительно хотите выйти?,Да ли сте сигурни да желите да се одјавите?,"Ste si istí, že chcete odhlásiť?",¿Seguro que quieres salir?,Är du säker på att du vill logga ut?,คุณแน่ใจว่าคุณต้องการที่จะออกจากระบบ?,Eger ikis yapmak istediğinden emin misin?
MAP,Map,hartë,خريطة,карта,Karta,Kort,Kaart,kaart,نقشه,Carte,Karte,Χάρτης,Térkép,Carta geografica,地図,žemėlapis,Kart,Mapa,Mapa,Hartă,карта,Мапа,mapa,Mapa,Karta,แผนที่,Harita
DEVICES,Devices,Devices,الأجهزة,устройства,uređaji,Enheder,apparaten,Devices,دستگاه ها,Dispositifs,Geräte,συσκευές,eszközök,dispositivi,デバイス,Prietaisai,enheter,Pomysłowość,Devices,Dispozitive,приборы,uređaji,prístroje,dispositivos,enheter,อุปกรณ์,Cihazlar
NOTIFICATIONS,Notifications,Njoftime,إخطارات,Известия,Obavijesti,underretninger,meldingen,Teated,اطلاعیه,notifications,Benachrichtigungen,Αναφορές,értesítések,notifiche,通知,Pranešimai,Varsler,Powiadomienia,notificações,notificări,Уведомления,Обавештења,oznámenia,Notificaciones,anmälningar,การแจ้งเตือน,Bildirimler
HISTORY,History,histori,التاريخ,история,Povijest,Historie,Geschiedenis,ajalugu,تاریخ,Histoire,Geschichte,Ιστορικό,Történelem,Storia,歴史,Istorija,Historie,Historia,História,Istorie,история,историја,histórie,Historia,Historia,ประวัติศาสตร์,tarih
ALERTS,Alerts,Administrim Shkarkimesh Faqerojtësa Fjalorë,التنبيهات,Сигнали,Upozorenja,Advarsler,Waarschuwingen,Alerts,هشدارها,alertes,Alerts,Ειδοποιήσεις,figyelmeztetések,avvisi,アラート,įspėjimai,varsler,Powiadomienia,alertas,Alerte,Оповещения,упозорења,výstrahy,alertas,varningar,การแจ้งเตือน,Uyarılar
SETTINGS,Settings,Cilësimet,إعدادات,Настройки,postavke,Indstillinger,instellingen,seaded,تنظیمات,Paramètres,Einstellungen,Ρυθμίσεις,Beállítások,impostazioni,設定,Nustatymai,innstillinger,Ustawienia,Configurações,Setări,настройки,Подешавања,nastavenie,ajustes,inställningar,การตั้งค่า,Ayarlar
STOPPED,Stopped,ndaloi,توقفت,Спряна,zaustavljen,Holdt op,gestopt,peatatud,متوقف,Arrêté,Gestoppt,Σταματημένο,megállt,Fermato,停止,sustabdyta,stoppet,Zatrzymany,Parado,Oprit,Остановился,Стоппед,zastavený,Detenido,stoppad,หยุด,Durduruldu
MOVING,Moving,Moving,متحرك,Движещ,Premještanje,Bevæger sig,In beweging,liikuv,در حال حرکت,En mouvement,bewegend,Κίνηση,Mozgó,In movimento,移動します,judantis,flytting,W ruchu,em movimento,In miscare,перемещение,Мовинг,pohyblivý,Emocionante,Rör på sig,การย้าย,hareketli
ENGINE_IDLE,Engine Idle,engine Idle,الخمول المحرك,Idle двигател,praznog hoda motora,Tomgangsvælger,engine Idle,mootori Idle,موتور بیکار,moteur Idle,Motor im Leerlauf,ρελαντί κινητήρα,Üresjárat,motore al minimo,エンジンのアイドル,Variklio laisvos eigos,tomgangs,na biegu jałowym,marcha lenta do motor,Idle Motor,режим малого газа двигателя,мотор у празном ходу,Idle Engine,ralentí del motor,Engine Idle,เครื่องยนต์ไม่ได้ใช้งาน,motor Rölanti
ADD_DEVICE,Add Device,Shto Device,اضف جهاز,Добавяне на устройство,Dodaj uređaja,Tilføj enhed,Voeg toestel toe,Lisa seade,افزودن دستگاه,Ajouter un appareil,Gerät hinzufügen,Προσθέστε ΣΥΣΚΕΥΗ,Eszköz hozzáadása,Aggiungi dispositivo,デバイスを追加,Pridėti Device,Legg til enhet,Dodaj urządzenie,Adicionar dispositivo,Adăugați un dispozitiv,Добавить устройство,Адд Девице,Pridať zariadenie,Añadir dispositivo,Lägg till enhet,เพิ่มอุปกรณ์,Cihaz ekle
EXPIRY_DATE,Subscription expiry date,Abonimi data e skadimit,تاريخ انتهاء الاشتراك,Абонамент срок на годност,Pretplata datum isteka,Abonnement udløbsdato,Inschrijving vervaldatum,Tellimus kõlblikkusaega,اشتراک تاریخ انقضاء,Abonnement date d'expiration,Abonnement Verfallsdatum,Ημερομηνία λήξης,Lejárati dátum,Abbonamento data di scadenza,サブスクリプションの有効期限,Prenumerata TINKAMUMO LAIKAS,Abonnement utløpsdato,Subskrypcja data ważności,data de expiração da assinatura,Abonament Data de expirare,Дата истечения срока действия подписки,Претплата рок трајања,Predplatné dátum exspirácie,Suscripción fecha de caducidad,Abonnemang utgångsdatum,จองซื้อวันหมดอายุ,Abonelik son kullanma tarihi
SPEED,Speed,shpejtësi,سرعة,скорост,Ubrzati,Fart,Snelheid,kiirus,سرعت,La vitesse,Geschwindigkeit,Ταχύτητα,Sebesség,Velocità,速度,greitis,Hastighet,Prędkość,Rapidez,Viteză,скорость,Брзина,rýchlosť,Velocidad,Fart,ความเร็ว,hız
ODOMETER,Odometer,rrugëmatës,عداد المسافات,одометър,mjerač za pređeni put,kilometertæller,Kilometerteller,odomeeter,کیلومتر شمار,Odomètre,Kilometerzähler,Οδόμετρο,Úthosszmérő,Odometro,オドメーター,odometras,kilometer~~POS=TRUNC,Drogomierz,odômetro,Contorul de kilometraj,одометр,мерач за пређени пут,počítač kilometrov,Cuentakilómetros,Vägmätare,วัดระยะทาง,Kilometre sayacı
BATTERY,Battery,bateri,البطارية,батерия,Baterija,Batteri,Accu,aku,باتری,Batterie,Batterie,Μπαταρία,Akkumulátor,Batteria,電池,baterija,Batteri,Bateria,Bateria,Baterie,аккумулятор,Батерија,batérie,Batería,Batteri,แบตเตอรี่,pil
IGNITION,Ignition,ndezje,اشتعال,запалване,Paljenje,Tænding,Ontsteking,süüde,احتراق,Allumage,Zündung,Κινητήρας,Gyújtás,Accensione,点火,degimas,Tenning,Zapłon,Ignição,Aprindere,Зажигание,паљење,zapaľovanie,Encendido,Tändning,การเผาไหม้,ateşleme
ADDRESS,Address,Adresë,عنوان,адрес,Adresa,Adresse,Adres,aadress,نشانی,Adresse,Adresse,Διεύθυνση,Cím,Indirizzo,住所,adresas,Adresse,Adres,Endereço,Adresa,Адрес,Адреса,adresa,Dirección,Adress,ที่อยู่,Adres
POSITION,Position,pozitë,موضع,позиция,Položaj,Position,Positie,seisukoht,موقعیت,Position,Position,Θέση,Pozíció,Posizione,ポジション,pozicija,Posisjon,Pozycja,Posição,Poziţie,Должность,положај,pozície,Posición,Placera,ตำแหน่ง,pozisyon
ALTITUDE,Altitude,lartësi,ارتفاع,Надморска височина,Visina,Højde,Hoogte,kõrgus,ارتفاع,Altitude,Höhe,Υψόμετρο,Magasság,Altitudine,高度,aukštis,Høyde,Wysokość,Altitude,Altitudine,высота над уровнем моря,висина,nadmorská výška,Altitud,Höjd över havet,ระดับความสูง,rakım
ANGLE,Angle,kënd,زاوية,ъгъл,Kut,Vinkel,Hoek,nurk,زاویه,Angle,Winkel,Γωνία,Szög,Angolo,角度,kampas,Angle,Kąt,Ângulo,Unghi,Угол,Угао,uhol,Ángulo,Vinkel,มุม,açı
TIME,Time,kohë,زمن,път,Vrijeme,Tid,Tijd,aeg,زمان,Temps,Zeit,χρόνος,Idő,Tempo,時間,Laikas,Tid,Czas,Tempo,Timp,Время,време,čas,Hora,Tid,เวลา,Zaman
MAP,Map,hartë,خريطة,карта,Karta,Kort,Kaart,kaart,نقشه,Carte,Karte,Χάρτης,Térkép,Carta geografica,地図,žemėlapis,Kart,Mapa,Mapa,Hartă,карта,Мапа,mapa,Mapa,Karta,แผนที่,Harita
LAST_HOUR,Last hour,orë e kaluar,الساعة الأخيرة,През последния час,Posljednji sat,sidste time,Laatste uur,viimase tunni,آخرین ساعت,Dernière heure,Letzte Stunde,Τελευταία ώρα,Utolsó óra,Ultima ora,最後の時間,Paskutinė valanda,Siste time,Ostatnia godzina,Última hora,Ultima ora,Последний час,Последњи сат,Posledná hodina,Ultima hora,Sista timmen,ชั่วโมงสุดท้าย,Son saat
TODAY,Today,sot,اليوم,днес,Danas,I dag,Vandaag,täna,امروز,Aujourd'hui,Heute,Σήμερα,Ma,Oggi,今日,šiandien,I dag,Dzisiaj,Hoje,Astăzi,Cегодня,Данас,dnes,Hoy,I dag,ในวันนี้,Bugün
YESTERDAY,Yesterday,Dje,في الامس,Вчера,Jučer,I går,Gisteren,eile,دیروز,Hier,Gestern,Εχθές,Tegnap,Ieri,昨日,vakar,I går,Wczoraj,Ontem,Ieri,Вчера,јуче,včera,Ayer,I går,เมื่อวาน,Dün
THIS_WEEK,This week,Këtë javë,هذا الاسبوع,Тази седмица,Ovaj tjedan,Denne uge,Deze week,See nädal,این هفته,Cette semaine,Diese Woche,Αυτή την εβδομάδα,Ezen a héten,Questa settimana,今週,Šią savaitę,Denne uka,W tym tygodniu,Esta semana,Săptămâna aceasta,На этой неделе,Ове недеље,Tento týždeň,Esta semana,Denna vecka,ในสัปดาห์นี้,Bu hafta
FROM,From,nga,من عند,от,Iz,Fra,Van,pärit,از جانب,De,Von,Από,Tól től,A partire dal,から,nuo,Fra,Od,A partir de,Din,Из,од,z,De,Från,จาก,itibaren
TO,To,Te,إلى,Да се,Do,Til,Tot,et,به,À,Nach,Προς την,Nak nek,A,に,į,Til,Do,Para,La,к,До,na,A,Till,ไปยัง,için
SEARCH,Search,kërkim,بحث,Търсене,traži,Søg,Zoeken,Otsing,جستجو کردن,Chercher,Suche,Αναζήτηση,Keresés,Ricerca,サーチ,Paieška,Søke,Szukanie,Pesquisa,Căutare,Поиск,Претрага,Vyhľadávanie,Buscar,Sök,ค้นหา,Arama
MOVEMENT_ALERT,Movement Alert,Lëvizja Alert,تنبيه الحركة,движение Alert,pokret upozorenja,bevægelse Alert,Movement Alert,liikumine Alert,هشدار جنبش,mouvement d'alerte,Bewegungs-Alarm,Σε κίνηση,mozgás Alert,Allarme del movimento,運動アラート,judėjimo įspėjimo,Movement Alert,ruch Alert,movimento Alerta,Mișcarea Alert,Движение оповещения,pokret Упозорење,alert pohyb,movimiento de alerta,Movement Alert,การแจ้งเตือนการเคลื่อนไหว,Hareket Uyarısı
SPEEDING_ALERT,Speeding Alert,shpejtimin Alert,مسرعة تنبيه,Ускоряване Alert,ubrzavanje upozorenja,Hurtigere Alert,Speeding Alert,Kiirustamise Alert,بالا بردن سرعت هشدار,alerte excès de vitesse,Speeding Alarm,Υπερ. Ταχύτητα,gyorshajtás Alert,Avviso di velocità,スピード違反の警告,paspartinti įspėjimo,Fartsovertredelse Alert,przyspieszenie Alert,Alerta acelerando,alertă excesul de viteză,Превышение скорости оповещение,Спеединг упозорења,urýchlenie Alert,Alerta de exceso de velocidad,fortkörning Alert,เร่งการแจ้งเตือน,hız Uyarısı
LOW_BATTERY_ALERT,Low Battery Alert,Low Battery Alert,منخفض تنبيه البطارية,Low Battery Alert,Niska upozorenja baterije,Lavt batteri Alert,Low Battery Alert,Aku tühjenemise märguanne,هشدار باتری کم,Alerte de batterie faible,Niedriger Batterie-Alarm,Χαμηλή μπαταρίας,Gyenge akkumulátor riasztás,Allarme basso della batteria,ローバッテリ警告,Žemas baterijos perspėjimas,Lavt batteri Alert,Low Battery Alert,Alerta bateria,Low Alert Acumulator,Низкий сигнал тревога батареи,Лов упозорења батерије,Alert Low Battery,Alerta de batería baja,Batterivarning,การแจ้งเตือนแบตเตอรี่ต่ำ,Düşük Pil Uyarısı
SHAKE_ALERT,Shake Alert,Shake Alert,هزة تنبيه,Shake Alert,Shake upozorenja,Shake Alert,Shake Alert,Shake Alert,تکان نشریه,secouer Alert,Shake Alarm,Shake Alert,Shake riasztás,Agitare Alert,シェイクアラート,suplakti įspėjimo,Shake Alert,wstrząsnąć Alert,Alerta de oscilação,alertă,Встряска оповещения,схаке Упозорење,shake Alert,Alerta Shake,Shake Alert,เขย่าแจ้งเตือน,Titremesi Uyarısı
POWER_ON_ALERT,Power on Alert,Fuqia në alarm,السلطة في حالة تأهب,Включване Alert,Snaga na oprezu,Tænd Alert,Power on Alert,Sisse- Alert,قدرت در حالت آماده باش,Puissance d'alerte,Einschaltwarnung,Ενεργοποίηση ειδοποίησης,Bekapcsolás Alert,Avviso di accensione,アラートの電源をオンにします,Įjungimo Uždaryti,Strøm på Alert,Włącz Alert,Alerta de alimentação,Putere la Alarma,Включение оповещения,Снага на Алерт,zapnutie Alert,La alerta de activación,Ström på Alert,มีอำนาจในการแจ้งเตือน,Alert Güç
